id,name,country,qs_rank,website_url,setting,size_category,ranking_year,top10_topic,scraped_at,search_embedding,tuition_usd,overall_acceptance_rate,test_policy,english_test_requirements,application_pathways_eligibility,deadline_calendar,program_supplemental_requirements,transfer_deferred_entry_options,program_specific_acceptance_rate,acceptance_rate_by_residency,admitted_gpa_percentiles,admitted_sat_act_percentiles,need_policy,class_profile_composition,selectivity_trend,tuition_fees,scholarship_deadlines_eligibility,acceptance_rate_by_round,major_impaction_signals,average_aid_merit_statistics,yield_rate,deferral_waitlist_indicators
43a42766-e70f-52a8-85fa-81705184a045,Massachusetts Institute of Technology (MIT),United States,1,https://mitadmissions.org/apply/firstyear/deadlines-requirements/,,,2026,,2026-03-21T02:12:21+00:00,,,,,,,,,,,,,,,,,,,,,,,
d7f0f085-5d64-5f8f-b5cd-c0fba4417b05,Imperial College London,United Kingdom,2,https://www.imperial.ac.uk/study/courses/undergraduate/2026/entry-requirements---2026/,,,2026,,2026-03-21T02:12:21+00:00,,,,,,,,,,,,,,,,,,,,,,,
eca45d2e-a3cf-55f1-a0ec-118f44ab2093,Stanford University,United States,3,https://admissionsight.com/stanford-common-data-set/,,,2026,,2026-03-21T02:12:21+00:00,,67731.00,"Not released for 2026 cycle; latest Class of 2028: 3.61% (2,067/57,326)",Required (SAT or ACT),"TOEFL, IELTS, or Duolingo for non-native speakers (assumed standard; not explicitly for 2026)","First-year: REA (Nov 1), RD (Jan 5); Transfer: separate app Mar 15; All via Common App",REA: Nov 1 (notif mid-Dec); RD: Jan 5 (notif early Apr); Arts Portfolio: Dec 5; Financial Aid priority: Nov 15 (REA),"Stanford Questions: 3 short essays (100-250 words), 3 short answers (50 words); Roommate note; No major-specific",Transfer app deadline Mar 15; Deferred entry (gap year) available upon request post-admit,Not released; admits to university undeclared,"Not released; private university, no in-state preference","Latest CDS: Avg 3.94; 73.3% 4.0, 16.5% 3.75-3.99, etc.","Class 2028 submitters: SAT m50% 1510-1570, ACT 34-35; Required for 2030",Need-blind for US citizens/PR/undocumented US HS; Need-aware for internationals,"Class 2029 enrolled: 1,866; 20% first-gen; 58% public HS, 28% private, 14% int; Ethnic: Asian 35%, Black 4%, Hisp 12%, White 25%, Multi 10%, Int 14%; Gender 48%W/52%M; 50 states/64 countries","Declining: Class 2024 5.19%, 2025 3.95%, 2026 3.68%, 2027 3.91%, 2028 3.61%","2025-26: Tuition $67,731; Room/Board $22,167; Total budget ~$97,545","Need-based only; Priority Nov 15 (REA); Meets full need, no loans; No merit",Not released (REA non-binding),"No signals; undeclared admission, change major open","Avg need-based grant $74,310 (freshman class); No merit","Class 2028: 82% (1,693/2,067)",Small % deferred from REA; Waitlist admits rare (~6% recent)
1bdab97b-ff83-53d6-b6d3-78cd3b019c17,University of Oxford,United Kingdom,4,https://www.ox.ac.uk/sites/files/oxford/AnnualAdmissionsStatisticalReport2025.pdf,,,2026,,2026-03-21T02:12:21+00:00,,,"14.1% admission rate (3,245/23,061); 16.4% offer rate (3,793/23,061) - 2024 cycle","Subject-specific admissions tests required for ~50 courses (e.g., LNAT Law, MAT Maths/Physics, ESAT Biomedical); online Oct 2025 for 2026 entry; no SAT/ACT","IELTS Academic 7.5 overall (≥7.0 each); TOEFL iBT 110 (≥22 L/R, ≥24 S/W); other equiv.; higher level required for all courses",All via UCAS (choose college or open); same process UK/int'l/mature; no quotas except Medicine int'l cap; second-degree applicants welcome,"UCAS: 15 Oct 2025 6pm UK; Tests: 21-27 Oct; Written work: 10 Nov; Interviews: early-mid Dec; Decisions: 13-14 Jan 2026. Single deadline, no ED/EA/RD","Course-specific: admissions tests (~50 courses), written work (humanities/languages), portfolio (Art); see table per course","No transfers (start year 1); Deferred entry accepted except Fine Art, History of Art, Grad Medicine; competitive","Varies widely: Economics & Mgmt 5.5%, Comp Sci 6.4%, Maths & Phil 6.9%, Biomed Sci 8.7%, Medicine ~9% (2024/25)","UK domicile ~17.8% (2,612/14,694); Overseas ~7.6% (633/~8,367) - 2024",N/A,N/A,"Need-aware, esp. international; aid assessed post-admission via household income","3,245 admitted (2024); 80.5% UK; 85.6% A*AA+ A-levels; gender/ethnicity/SES breakdowns in report","Stable: 2020-2024 admission rates 13.6%-14.1%, offer 15.3%-16.8%","Home/UK: £9,790 (2026/27); Overseas: £37,380-£62,820 (varies by course)","Crankstart (UK ≤£32,500 income, auto); Reach Oxford (low-income countries, app 4 Feb 2026); college-specific",N/A,"Economics & Mgmt, Comp Sci, Maths most competitive (<7% rates); Medicine capped for int'l","Oxford Bursary: up to £6,270/yr for lowest-income UK; limited merit/need for int'l","85.6% (3,245 admits/3,793 offers - 2024)",Deferred entry competitive (strongest applicants); ~10% pooled/reallocated via Winter Pool
f599cb8b-102b-5851-94bc-7ccbf65f7ef1,Harvard University,United States,5,,,,2026,,2026-03-21T02:12:21+00:00,,,,,,,,,,,,,,,,,,,,,,,
340544d3-8b8d-5549-b67e-deb1739470f7,University of Cambridge,United Kingdom,6,https://www.undergraduate.study.cam.ac.uk/apply/application-dates-deadlines,,,2026,,2026-03-21T02:12:21+00:00,,,"16.4% (3,632 acceptances out of 22,153 applications in 2024 admissions cycle)","No SAT/ACT required. Course-specific pre-interview admissions tests required for many programs (e.g. ESAT for Engineering, Natural Sciences; TMUA for Computer Science, Economics; LNAT for Law; UCAT for Medicine). College-specific at-interview assessments for some arts/humanities.",IELTS Academic: 7.5 overall (7.0+ each); TOEFL iBT/Home (pre-Jan 2026): 110 overall (25+ each); Cambridge C2 Proficiency: 200 (185+ no element); or equivalent C1 CEFR from school exam.,"All undergraduate applicants apply via UCAS. Same process for UK/Home, EU, International, mature (21+), disabled, care leavers. Mature may have January UCAS deadline but Cambridge requires October deadline for consideration.",Single deadline: UCAS application by 15 October 2026 (6pm UK time) for 2027 entry. My Cambridge Application by 22 October 2026. No ED/EA/RD rounds.,"My Cambridge Application (post-UCAS): funding evidence for international students, optional Cambridge-specific personal statement, £60 application fee for overseas applicants. Written work submission for some courses (e.g. History, English).","Deferred entry: possible, specify in UCAS. Transfers: possible from other UK universities but rare and course/college-specific; not from overseas. Check course pages.","Varies: Architecture 12.2% (64/526), Veterinary Medicine 19.9% (67/336), Natural Sciences ~14%; full table in 2024 cycle report (22k apps total).","Not explicitly stated; Home (UK) schools: Maintained 18.8%, Independent 11.1%; Overseas implied lower (~10-12% from secondary sources). No in-state/OOS (UK national).",,,Not explicitly stated; likely need-aware for international students (must provide funding evidence); Home students government loans.,48% men:52% women; 15.8% declared disability; 94.7% A*AA or better (best 3 A-levels); from maintained schools 52.2% of acceptances.,"Stable ~16%: 2025 16.3%, 2024 16.4%, 2023 16.6%, 2022 15.8%, 2021 16.1%, 2020 19.6%.","Home (first UG): £9,535/year; International: £29,052 (Group 1 arts/humanities) to £50,000+ (Medicine/Vet) + College fee £10,017-£13,662 (2025-26 rates, fixed for course duration).","Cambridge Trust (int'l, post-offer); college bursaries; eligibility: academic merit/need; deadlines vary (often Jan-May post-offer). Full funding evidence required by May/June for visa.",,"High competition: Medicine, Computer Science, Economics, HSPS (success rates <15%); ~6 apps/place overall.",,"76.3% (3,632 acceptances / 4,760 offers, 2024 cycle)","Winter Pool: ~1,000 applicants pooled, ~200 offers (~20% success); August pool for unmet conditions."
edc39018-d7f2-5f78-aebe-836d3aea4091,ETH Zurich,Switzerland,7,https://ethz.ch/en/studies/bachelor/application/non-swiss-matriculation-certificate/dates.html,,,2026,,2026-03-21T02:12:21+00:00,,,"No official rate published; third-party estimates ~27% overall (Bachelor's 25-30%, Master's 10-20%)",ETH entrance examination required for many international Bachelor's applicants without Swiss Matura equivalent (comprehensive 8 subjects or reduced 4 subjects); no SAT/ACT,"Not required for Bachelor's (German C1 required); Master's: TOEFL iBT 100, IELTS 7.0, or equivalent (exemptions apply)",Bachelor's: Swiss Matura direct; non-Swiss: swissuniversities qualification or ETH entrance exam; Master's: Bachelor's degree matching program requirements,"Bachelor's Autumn 2026: 1 Dec 2025 - 31 Mar 2026; Master's Autumn 2026: Internationals 1-30 Nov 2025, Swiss Bachelor's 1-30 Apr 2026; no ED/EA","No essays, LORs, or supplements; standard docs: transcripts, language cert, declaration; program choice in app",Transfer: Recognition up to 60 ECTS from other universities (fee CHF 50); Deferred: Possible for military/civil service; no general deferral,,,,N/A - no SAT/ACT required,Need-aware; scholarships consider family income/assets after parental responsibility,"New Bachelor's: ~35% women, ~27% international; total students 26k, 43% intl",New Bachelor's enrollments stable ~3600/year after growth; total students up from 21k to 26k,CHF 730/semester (Swiss residents); CHF 2190/semester (intl from HS2025); + semester fees ~74CHF,"Social scholarships: Sep 1-Oct 31 for next year; ESOP with Master's app Nov; need-based/merit, first-time students, progress req",,Mechanical Engineering and Computer Science most popular Bachelor's programs,,,
